{
  "version": "1.0.0",
  "game_id": "dokdo_arc_webgame",
  "categories": [
    "weapon",
    "ammo",
    "gear",
    "consumable",
    "crafting",
    "utility",
    "quest",
    "barter"
  ],
  "items": [
    {
      "item_id": "itm_pipe_rusted",
      "name_ko": "녹슨 쇠파이프",
      "name_en": "Rusted Pipe",
      "category": "weapon",
      "subcategory": "melee",
      "rarity": "common",
      "stackable": false,
      "max_stack": 1,
      "weight": 2.4,
      "size": 2,
      "value": 20,
      "introduced_in": "CH01",
      "equip_slot": "main_hand",
      "durability": {
        "max": 80,
        "current": 80
      },
      "stats": {
        "attack": 10,
        "noise": 2
      },
      "tags": [
        "starter",
        "melee"
      ],
      "description": "여의도 기록국 신참 회수대 기본 근접무기."
    },
    {
      "item_id": "itm_office_knife",
      "name_ko": "사무용 칼",
      "name_en": "Office Knife",
      "category": "weapon",
      "subcategory": "melee",
      "rarity": "common",
      "stackable": false,
      "max_stack": 1,
      "weight": 0.4,
      "size": 1,
      "value": 12,
      "introduced_in": "CH01",
      "equip_slot": "off_hand",
      "durability": {
        "max": 40,
        "current": 40
      },
      "stats": {
        "attack": 5,
        "bleed": 5
      },
      "tags": [
        "light",
        "loot"
      ],
      "description": "짧지만 빠르다. 내구도가 낮다."
    },
    {
      "item_id": "itm_service_pistol",
      "name_ko": "보안용 권총",
      "name_en": "Service Pistol",
      "category": "weapon",
      "subcategory": "firearm",
      "rarity": "uncommon",
      "stackable": false,
      "max_stack": 1,
      "weight": 1.1,
      "size": 2,
      "value": 90,
      "introduced_in": "CH01",
      "equip_slot": "main_hand",
      "durability": {
        "max": 100,
        "current": 100
      },
      "stats": {
        "attack": 20,
        "noise": 12,
        "ammo_type": "itm_ammo_9mm"
      },
      "tags": [
        "ranged"
      ],
      "description": "기록국 표준 단거리 화기."
    },
    {
      "item_id": "itm_maintenance_wrench",
      "name_ko": "정비 렌치",
      "name_en": "Maintenance Wrench",
      "category": "weapon",
      "subcategory": "melee",
      "rarity": "uncommon",
      "stackable": false,
      "max_stack": 1,
      "weight": 1.6,
      "size": 2,
      "value": 35,
      "introduced_in": "CH02",
      "equip_slot": "main_hand",
      "durability": {
        "max": 90,
        "current": 90
      },
      "stats": {
        "attack": 12,
        "stagger": 10
      },
      "tags": [
        "tool",
        "melee"
      ],
      "description": "기계 파손에도 쓸 수 있는 묵직한 공구."
    },
    {
      "item_id": "itm_cleaver_market",
      "name_ko": "시장 식도",
      "name_en": "Market Cleaver",
      "category": "weapon",
      "subcategory": "melee",
      "rarity": "uncommon",
      "stackable": false,
      "max_stack": 1,
      "weight": 1.0,
      "size": 2,
      "value": 45,
      "introduced_in": "CH02",
      "equip_slot": "main_hand",
      "durability": {
        "max": 70,
        "current": 70
      },
      "stats": {
        "attack": 14,
        "bleed": 8
      },
      "tags": [
        "loot"
      ],
      "description": "노량진 수몰 상권에서 자주 발견된다."
    },
    {
      "item_id": "itm_signal_flare",
      "name_ko": "신호탄",
      "name_en": "Signal Flare",
      "category": "utility",
      "subcategory": "throwable",
      "rarity": "rare",
      "stackable": true,
      "max_stack": 3,
      "weight": 0.3,
      "size": 1,
      "value": 55,
      "introduced_in": "CH03",
      "stats": {
        "noise": 18,
        "light": 20
      },
      "effects": [
        {
          "effect_type": "add_noise",
          "value": 18
        }
      ],
      "tags": [
        "throwable",
        "light"
      ],
      "description": "위험하지만 적 유도와 구역 조명에 강력하다."
    },
    {
      "item_id": "itm_shock_baton",
      "name_ko": "보안 전기봉",
      "name_en": "Shock Baton",
      "category": "weapon",
      "subcategory": "melee",
      "rarity": "rare",
      "stackable": false,
      "max_stack": 1,
      "weight": 1.3,
      "size": 2,
      "value": 110,
      "introduced_in": "CH05",
      "equip_slot": "main_hand",
      "durability": {
        "max": 90,
        "current": 90
      },
      "stats": {
        "attack": 18,
        "stun": 14
      },
      "tags": [
        "security"
      ],
      "description": "판교 미러센터 보안 장비."
    },
    {
      "item_id": "itm_ammo_9mm",
      "name_ko": "9mm 탄약",
      "name_en": "9mm Ammo",
      "category": "ammo",
      "subcategory": "handgun",
      "rarity": "common",
      "stackable": true,
      "max_stack": 30,
      "weight": 0.02,
      "size": 1,
      "value": 4,
      "introduced_in": "CH01",
      "stats": {
        "caliber": "9mm"
      },
      "tags": [
        "ammo"
      ],
      "description": "권총용 표준 탄약."
    },
    {
      "item_id": "itm_mask_cloth",
      "name_ko": "천 마스크",
      "name_en": "Cloth Mask",
      "category": "gear",
      "subcategory": "mask",
      "rarity": "common",
      "stackable": false,
      "max_stack": 1,
      "weight": 0.2,
      "size": 1,
      "value": 8,
      "introduced_in": "CH01",
      "equip_slot": "mask",
      "durability": {
        "max": 20,
        "current": 20
      },
      "stats": {
        "filter_bonus": 5
      },
      "tags": [
        "starter"
      ],
      "description": "응급 수준의 방호력만 제공한다."
    },
    {
      "item_id": "itm_mask_filter_basic",
      "name_ko": "기본 필터 마스크",
      "name_en": "Basic Filter Mask",
      "category": "gear",
      "subcategory": "mask",
      "rarity": "uncommon",
      "stackable": false,
      "max_stack": 1,
      "weight": 0.8,
      "size": 2,
      "value": 60,
      "introduced_in": "CH01",
      "equip_slot": "mask",
      "durability": {
        "max": 100,
        "current": 100
      },
      "stats": {
        "filter_bonus": 25
      },
      "tags": [
        "filter"
      ],
      "description": "초중반 핵심 방호 장비.",
      "recipe": {
        "station": "workbench",
        "inputs": [
          {
            "item_id": "itm_mask_cloth",
            "qty": 1
          },
          {
            "item_id": "itm_filter_pad",
            "qty": 1
          },
          {
            "item_id": "itm_cable_tie",
            "qty": 2
          }
        ]
      }
    },
    {
      "item_id": "itm_filter_pad",
      "name_ko": "필터 패드",
      "name_en": "Filter Pad",
      "category": "consumable",
      "subcategory": "filter",
      "rarity": "uncommon",
      "stackable": true,
      "max_stack": 5,
      "weight": 0.1,
      "size": 1,
      "value": 22,
      "introduced_in": "CH01",
      "effects": [
        {
          "effect_type": "restore_filter",
          "value": 30
        }
      ],
      "tags": [
        "filter",
        "repair"
      ],
      "description": "필터 마스크 내구도를 회복한다."
    },
    {
      "item_id": "itm_flashlight",
      "name_ko": "손전등",
      "name_en": "Flashlight",
      "category": "gear",
      "subcategory": "light",
      "rarity": "common",
      "stackable": false,
      "max_stack": 1,
      "weight": 0.5,
      "size": 1,
      "value": 18,
      "introduced_in": "CH01",
      "equip_slot": "tool",
      "durability": {
        "max": 100,
        "current": 100
      },
      "stats": {
        "battery_use": 5,
        "vision_bonus": 1
      },
      "tags": [
        "light"
      ],
      "description": "어두운 계단실과 자료실 탐색에 필수.",
      "recipe": {
        "station": "workbench",
        "inputs": [
          {
            "item_id": "itm_battery_pack",
            "qty": 1
          },
          {
            "item_id": "itm_copper_wire",
            "qty": 1
          }
        ]
      }
    },
    {
      "item_id": "itm_battery_pack",
      "name_ko": "예비 배터리 팩",
      "name_en": "Battery Pack",
      "category": "consumable",
      "subcategory": "power",
      "rarity": "common",
      "stackable": true,
      "max_stack": 4,
      "weight": 0.2,
      "size": 1,
      "value": 16,
      "introduced_in": "CH01",
      "effects": [
        {
          "effect_type": "restore_battery",
          "value": 25
        }
      ],
      "tags": [
        "power"
      ],
      "description": "손전등, 센서, 단말기에 사용한다."
    },
    {
      "item_id": "itm_backpack_field_6",
      "name_ko": "현장 배낭 6칸형",
      "name_en": "Field Backpack 6",
      "category": "gear",
      "subcategory": "backpack",
      "rarity": "common",
      "stackable": false,
      "max_stack": 1,
      "weight": 1.0,
      "size": 2,
      "value": 30,
      "introduced_in": "CH01",
      "equip_slot": "backpack",
      "stats": {
        "carry_limit_bonus": 0,
        "slots": 6
      },
      "tags": [
        "starter"
      ],
      "description": "기본 지급형 배낭."
    },
    {
      "item_id": "itm_backpack_salvage_10",
      "name_ko": "회수 배낭 10칸형",
      "name_en": "Salvage Backpack 10",
      "category": "gear",
      "subcategory": "backpack",
      "rarity": "uncommon",
      "stackable": false,
      "max_stack": 1,
      "weight": 1.6,
      "size": 3,
      "value": 75,
      "introduced_in": "CH02",
      "equip_slot": "backpack",
      "stats": {
        "carry_limit_bonus": 4,
        "slots": 10
      },
      "tags": [
        "inventory"
      ],
      "description": "노량진과 잠실에서 획득 가능한 중형 배낭."
    },
    {
      "item_id": "itm_climbing_hook",
      "name_ko": "등반용 훅",
      "name_en": "Climbing Hook",
      "category": "utility",
      "subcategory": "movement",
      "rarity": "rare",
      "stackable": false,
      "max_stack": 1,
      "weight": 1.2,
      "size": 2,
      "value": 80,
      "introduced_in": "CH03",
      "stats": {
        "unlock_route": "vertical"
      },
      "tags": [
        "movement"
      ],
      "description": "고층 외벽과 붕괴 구조물 우회에 사용한다."
    },
    {
      "item_id": "itm_rubber_waders",
      "name_ko": "방수 웨이더",
      "name_en": "Rubber Waders",